{
  "operation_id": "operation-session-1",
  "attempt_id": "attempt-session-1",
  "fencing_token": 1,
  "sandbox_id": "sandbox-1",
  "runtime_session_id": "session-1",
  "runtime_type": "terminal",
  "capability_profile_id": "terminal-v1",
  "protocol": "websocket",
  "internal_endpoint_reference": "ref:session:opaque-1",
  "connection_generation": 1,
  "expires_at": "2026-08-21T00:04:00Z"
}
